{
  "document_kind": "provider-proposal-history-conformance-01",
  "authority": "synthetic metadata only; no accepted route, reader, grant, review or send authority",
  "limits": {
    "descriptor_bytes": 4096,
    "request_bytes": 8192,
    "revision": 128
  },
  "specimens": [
    {
      "name": "owner-local",
      "descriptor": {
        "profile": "workflow-action-02",
        "action": {
          "account_id": "00000000-0000-0000-0000-000000000001",
          "action_id": "00000000-0000-0000-0000-00000000000a",
          "revision": 1,
          "line_id": "00000000-0000-0000-0000-00000000000b",
          "recipient_id": "00000000-0000-0000-0000-00000000000c",
          "purpose_id": "00000000-0000-0000-0000-000000000001",
          "content_ref": "00000000-0000-0000-0000-00000000000d",
          "content_digest": "abababababababababababababababababababababababababababababababab",
          "content_version": 1,
          "not_before": 2000000000,
          "expires_at": 2000000300,
          "timezone": "UTC",
          "window_id": "fixture-window",
          "routine_id": "00000000-0000-0000-0000-00000000000e",
          "authority_generation": 1,
          "commitment": "sensitive"
        },
        "route": {
          "kind": "provider",
          "adapter": "telnyx-sms-v2",
          "route_id": "00000000-0000-0000-0000-000000000014",
          "route_version": 1,
          "organization_id": "00000000-0000-0000-0000-000000000002",
          "messaging_profile_id": "00000000-0000-0000-0000-000000000003",
          "sender_config_id": "00000000-0000-0000-0000-000000000015",
          "sender_config_version": 1,
          "route_fingerprint": "2ce6fbb7810f27d51d5906c9a1b16833dd224c339c3b12099d8607447c98bfc0",
          "eligibility_policy_id": "00000000-0000-0000-0000-000000000016",
          "eligibility_policy_version": 1,
          "eligibility_digest": "cdcdcdcdcdcdcdcdcdcdcdcdcdcdcdcdcdcdcdcdcdcdcdcdcdcdcdcdcdcdcdcd",
          "exposure_route_policy_id": "00000000-0000-0000-0000-000000000017",
          "exposure_policy_version": 1
        },
        "reader": {
          "kind": "owner_local",
          "role": 2,
          "key_id": "0101010101010101010101010101010101010101010101010101010101010101",
          "trust_generation": 1,
          "manifest_version": 1,
          "manifest_digest": "0202020202020202020202020202020202020202020202020202020202020202"
        },
        "disclosure": {
          "mode": "provider_plaintext",
          "recipient_commitment": "5afca772560f2d440678bd819ec6dc0c726714a19e96fc2cdb05c38d154cbaa7",
          "request_digest": "0075fec7caed9bb7f6ed3570f6c41bdf8007da81e7e8af7bd2cb6218363e8efb"
        }
      },
      "canonical_descriptor": "{\"action\":{\"account_id\":\"00000000-0000-0000-0000-000000000001\",\"action_id\":\"00000000-0000-0000-0000-00000000000a\",\"authority_generation\":1,\"commitment\":\"sensitive\",\"content_digest\":\"abababababababababababababababababababababababababababababababab\",\"content_ref\":\"00000000-0000-0000-0000-00000000000d\",\"content_version\":1,\"expires_at\":2000000300,\"line_id\":\"00000000-0000-0000-0000-00000000000b\",\"not_before\":2000000000,\"purpose_id\":\"00000000-0000-0000-0000-000000000001\",\"recipient_id\":\"00000000-0000-0000-0000-00000000000c\",\"revision\":1,\"routine_id\":\"00000000-0000-0000-0000-00000000000e\",\"timezone\":\"UTC\",\"window_id\":\"fixture-window\"},\"disclosure\":{\"mode\":\"provider_plaintext\",\"recipient_commitment\":\"5afca772560f2d440678bd819ec6dc0c726714a19e96fc2cdb05c38d154cbaa7\",\"request_digest\":\"0075fec7caed9bb7f6ed3570f6c41bdf8007da81e7e8af7bd2cb6218363e8efb\"},\"profile\":\"workflow-action-02\",\"reader\":{\"key_id\":\"0101010101010101010101010101010101010101010101010101010101010101\",\"kind\":\"owner_local\",\"manifest_digest\":\"0202020202020202020202020202020202020202020202020202020202020202\",\"manifest_version\":1,\"role\":2,\"trust_generation\":1},\"route\":{\"adapter\":\"telnyx-sms-v2\",\"eligibility_digest\":\"cdcdcdcdcdcdcdcdcdcdcdcdcdcdcdcdcdcdcdcdcdcdcdcdcdcdcdcdcdcdcdcd\",\"eligibility_policy_id\":\"00000000-0000-0000-0000-000000000016\",\"eligibility_policy_version\":1,\"exposure_policy_version\":1,\"exposure_route_policy_id\":\"00000000-0000-0000-0000-000000000017\",\"kind\":\"provider\",\"messaging_profile_id\":\"00000000-0000-0000-0000-000000000003\",\"organization_id\":\"00000000-0000-0000-0000-000000000002\",\"route_fingerprint\":\"2ce6fbb7810f27d51d5906c9a1b16833dd224c339c3b12099d8607447c98bfc0\",\"route_id\":\"00000000-0000-0000-0000-000000000014\",\"route_version\":1,\"sender_config_id\":\"00000000-0000-0000-0000-000000000015\",\"sender_config_version\":1}}",
      "descriptor_bytes": 1816,
      "binding_digest": "0a5b3363d9d9ff8ea8dcb0a1b1eebe137a895abf0821e6b6e3635946136e4ade",
      "key": {
        "account_id": "00000000-0000-0000-0000-000000000001",
        "action_id": "00000000-0000-0000-0000-00000000000a",
        "revision": 1,
        "binding_digest": "0a5b3363d9d9ff8ea8dcb0a1b1eebe137a895abf0821e6b6e3635946136e4ade"
      },
      "request_id": "00000000-0000-0000-0000-000000000064",
      "canonical_request": "{\"descriptor\":{\"action\":{\"account_id\":\"00000000-0000-0000-0000-000000000001\",\"action_id\":\"00000000-0000-0000-0000-00000000000a\",\"authority_generation\":1,\"commitment\":\"sensitive\",\"content_digest\":\"abababababababababababababababababababababababababababababababab\",\"content_ref\":\"00000000-0000-0000-0000-00000000000d\",\"content_version\":1,\"expires_at\":2000000300,\"line_id\":\"00000000-0000-0000-0000-00000000000b\",\"not_before\":2000000000,\"purpose_id\":\"00000000-0000-0000-0000-000000000001\",\"recipient_id\":\"00000000-0000-0000-0000-00000000000c\",\"revision\":1,\"routine_id\":\"00000000-0000-0000-0000-00000000000e\",\"timezone\":\"UTC\",\"window_id\":\"fixture-window\"},\"disclosure\":{\"mode\":\"provider_plaintext\",\"recipient_commitment\":\"5afca772560f2d440678bd819ec6dc0c726714a19e96fc2cdb05c38d154cbaa7\",\"request_digest\":\"0075fec7caed9bb7f6ed3570f6c41bdf8007da81e7e8af7bd2cb6218363e8efb\"},\"profile\":\"workflow-action-02\",\"reader\":{\"key_id\":\"0101010101010101010101010101010101010101010101010101010101010101\",\"kind\":\"owner_local\",\"manifest_digest\":\"0202020202020202020202020202020202020202020202020202020202020202\",\"manifest_version\":1,\"role\":2,\"trust_generation\":1},\"route\":{\"adapter\":\"telnyx-sms-v2\",\"eligibility_digest\":\"cdcdcdcdcdcdcdcdcdcdcdcdcdcdcdcdcdcdcdcdcdcdcdcdcdcdcdcdcdcdcdcd\",\"eligibility_policy_id\":\"00000000-0000-0000-0000-000000000016\",\"eligibility_policy_version\":1,\"exposure_policy_version\":1,\"exposure_route_policy_id\":\"00000000-0000-0000-0000-000000000017\",\"kind\":\"provider\",\"messaging_profile_id\":\"00000000-0000-0000-0000-000000000003\",\"organization_id\":\"00000000-0000-0000-0000-000000000002\",\"route_fingerprint\":\"2ce6fbb7810f27d51d5906c9a1b16833dd224c339c3b12099d8607447c98bfc0\",\"route_id\":\"00000000-0000-0000-0000-000000000014\",\"route_version\":1,\"sender_config_id\":\"00000000-0000-0000-0000-000000000015\",\"sender_config_version\":1}},\"request_id\":\"00000000-0000-0000-0000-000000000064\"}",
      "request_bytes": 1883,
      "state": {
        "key": {
          "account_id": "00000000-0000-0000-0000-000000000001",
          "action_id": "00000000-0000-0000-0000-00000000000a",
          "revision": 1,
          "binding_digest": "0a5b3363d9d9ff8ea8dcb0a1b1eebe137a895abf0821e6b6e3635946136e4ade"
        },
        "record_version": 1,
        "phase": "proposed"
      }
    },
    {
      "name": "customer-selected",
      "descriptor": {
        "profile": "workflow-action-02",
        "action": {
          "account_id": "00000000-0000-0000-0000-000000000001",
          "action_id": "00000000-0000-0000-0000-00000000000a",
          "revision": 1,
          "line_id": "00000000-0000-0000-0000-00000000000b",
          "recipient_id": "00000000-0000-0000-0000-00000000000c",
          "purpose_id": "00000000-0000-0000-0000-000000000001",
          "content_ref": "00000000-0000-0000-0000-00000000000d",
          "content_digest": "abababababababababababababababababababababababababababababababab",
          "content_version": 1,
          "not_before": 2000000000,
          "expires_at": 2000000300,
          "timezone": "UTC",
          "window_id": "fixture-window",
          "routine_id": "00000000-0000-0000-0000-00000000000e",
          "authority_generation": 1,
          "commitment": "sensitive"
        },
        "route": {
          "kind": "provider",
          "adapter": "telnyx-sms-v2",
          "route_id": "00000000-0000-0000-0000-000000000014",
          "route_version": 1,
          "organization_id": "00000000-0000-0000-0000-000000000002",
          "messaging_profile_id": "00000000-0000-0000-0000-000000000003",
          "sender_config_id": "00000000-0000-0000-0000-000000000015",
          "sender_config_version": 1,
          "route_fingerprint": "2ce6fbb7810f27d51d5906c9a1b16833dd224c339c3b12099d8607447c98bfc0",
          "eligibility_policy_id": "00000000-0000-0000-0000-000000000016",
          "eligibility_policy_version": 1,
          "eligibility_digest": "cdcdcdcdcdcdcdcdcdcdcdcdcdcdcdcdcdcdcdcdcdcdcdcdcdcdcdcdcdcdcdcd",
          "exposure_route_policy_id": "00000000-0000-0000-0000-000000000017",
          "exposure_policy_version": 1
        },
        "reader": {
          "kind": "customer_selected",
          "role": 3,
          "key_id": "0101010101010101010101010101010101010101010101010101010101010101",
          "trust_generation": 1,
          "manifest_version": 1,
          "manifest_digest": "0202020202020202020202020202020202020202020202020202020202020202",
          "grant_id": "00000000-0000-0000-0000-00000000001e",
          "grant_version": 1
        },
        "disclosure": {
          "mode": "provider_plaintext",